Question,Strongly agree,Agree,Neutral,Disagree,Strongly disagree
"Patients engaged and connected with each other",5,1,0,0,0
"Staff and patients had meaningful interactions",4,2,0,0,0
"I learned something new to tailor care",4,1,1,0,0
"Strengthened relationships between patients",3,3,0,0,0
"Sparked new conversations outside sessions",3,3,0,0,0
"Learnt about colleagues to work more effectively",3,1,2,0,0
"Strengthened relationships with staff",2,4,0,0,0
"Incorporated new techniques into patient care",1,2,3,0,0